"时间段","画面类型","分镜画面","台词","亮点"
"00:00.0-00:04.5","其他画面","俯瞰未来城市，巨大的外星飞船悬浮在空中，展现极高科技文明。","这条时间线上的地球，虽然有着极高的科技文明，但外星人实力也不容小觑啊。","宏大的科幻场景开场，视觉冲击力强"
"00:04.5-00:06.8","录屏画面","游戏界面显示武器系统，包括磁轨炮、集束激光炮等升级选项。","每次外星人舰队来袭，我就犯了难。","展示游戏核心养成系统，引发玩家共鸣"
"00:06.8-00:16.5","其他画面","战机穿梭在未来建筑间，巨大的机械装置旋转开启，展现科幻战争氛围。","打不过根本打不过，妹妹我真的太难了。要想击败外星人，首先是选择强力的武器。","电影级运镜，营造紧张的战争压迫感"
"00:16.5-00:22.8","录屏画面","玩家操作升级湮灭炮，开启行星护盾，展示防御与恢复机制。","比如研究湮灭炮，把地表防御做到极致，接着咱们还可以开启行星护盾，既能抵消外星舰群攻击，又可以恢复母星耐久。","详细展示策略玩法，体现游戏深度"
"00:22.8-00:32.0","其他画面","镜头进入飞船内部，展示太空舰队集结并向外星基地发起反攻，最后定格在驾驶舱视角。","当然，最重要的是建造我们自己的太空舰队，我将率领人类联盟击退外星人，反攻外星生命基地。家人们这么好玩的游戏，你也赶紧来试试吧。","燃点十足的反攻画面，配合号召性台词完成转化"
